id,type,name,status,details,special,startTime,duration
1,SIMPLE_TASK,"ИЗ ФАЙЛА, Первая простая, простая задача",NEW,"Детали к "первой" простой задачи ИЗ ФАЙЛА",2023-02-01T08:00,2023-02-02T14:00,1800
2,SIMPLE_TASK,"ИЗ ФАЙЛА, Вторая простая задача",NEW,"Детали ко второй простой задачи ИЗ ФАЙЛА",2023-02-10T08:00,2023-02-10T23:00,900
3,EPIC,"ИЗ ФАЙЛА, Первый эпик",NEW,"Детали первого эпика","subtaskReferences:[4, 5, 6]",2023-02-15T08:00,2023-02-15T11:00,180
4,SUBTASK,"ИЗ ФАЙЛА, Первая подзадача к первому эпику",NEW,"Детали первой подзадачи к первому эпику ИЗ ФАЙЛА",3,2023-02-15T08:00,2023-02-15T09:00,60
5,SUBTASK,"ИЗ ФАЙЛА, Вторая подзадача к "первому", первому эпику",NEW,"Детали второй подзадачи к первому эпику ИЗ ФАЙЛА",3,2023-02-16T08:00,2023-02-16T09:00,60
6,SUBTASK,"ИЗ ФАЙЛА, Третья подзадача к первому эпику",NEW,"Детали третьей подзадачи к первому эпику ИЗ ФАЙЛА",3,2023-02-17T08:00,2023-02-17T09:00,60
7,EPIC,"ИЗ ФАЙЛА, Второй эпик",NEW,"Детали второго эпика","subtaskReferences:[]"

2,3,1,7
